<TestCase cycles="1" initialRequestMessageID="1" name="Authenticated REGISTER and INVITE" xmlns:xsi="http://www.w3.org/2001/XMLSchema-instance" xsi:noNamespaceSchemaLocation="TestCaseSchema.xsd">
	
	<Variables>
		<Var name="attackerNr">
			<ClearText><![CDATA[1111]]></ClearText>
		</Var>
		<Var name="targetNr">
			<ClearText><![CDATA[2222]]></ClearText>
		</Var>
		<Var name="attackerIP">
			<ConfigValue paramName="TestCaseSocketIP"/>
		</Var>
		<Var name="attackerPort">
			<ConfigValue paramName="TestCaseSocketPort"/>
		</Var>
		<Var name="targetIP">
			<ConfigValue paramName="TargetIP"/>
		</Var>
		<Var name="call_ID_REGISTER">
			<StringMutationFuzzer length="10"/>
		</Var>
		<Var name="call_ID_INVITE">
			<StringMutationFuzzer length="10"/>
		</Var>
		<Var name="sdp_ID">
			<NumberRangeFuzzer minimum="100000000" maximum="999999999"/>
		</Var>
		<Var name="secret">
			<ClearText>123456</ClearText>
		</Var>
	</Variables>
	
	<Request requestID="1">
		<Timeout timeInMilliseconds="2000" message="no answer"/>
		<Content><![CDATA[REGISTER sip:/'targetIP'/ SIP/2.0
Via: SIP/2.0/UDP /'attackerIP'/:/'attackerPort'/
Max-Forwards: 20
To: <sip:/'attackerNr'/@/'targetIP'/>
From: <sip:/'attackerNr'/@/'attackerIP'/>;tag=RegisterAndInviteAttempt
Call-ID: /'call_ID_REGISTER'/@/'targetIP'/
CSeq: 1 REGISTER
Contact: <sip:/'attackerNr'/@/'attackerIP'/:/'attackerPort'/>
Content-Length: 0

]]></Content>
		<Response category="warning">
			<!-- REGISTER was accepted by the Proxy -->
			<Regex><![CDATA[(SIP/2.0 200)((.*)(\r\n))+(Call-ID: /'call_ID_REGISTER'/@/'targetIP'/)]]></Regex>
		</Response>
		<Response category="okay" followingRequestID="21" waitingTimeInMilliseconds="500">
			<!-- Proxy Authentication Required -->
			<Regex><![CDATA[(SIP/2.0 407)((.*)(\r\n))+(Call-ID: /'call_ID_REGISTER'/@/'targetIP'/)]]></Regex>
			<ResponseVariables>
				<ResponseVar name="nonceRegister">
					<ResponseCatcher catchGroupIndex="2">
						<Regex><![CDATA[(nonce=")(.*?)(")]]></Regex>
					</ResponseCatcher>
				</ResponseVar>
				<ResponseVar name="realmRegister">
					<ResponseCatcher catchGroupIndex="2">
						<Regex><![CDATA[(realm=")(.*?)(")]]></Regex>
					</ResponseCatcher>
				</ResponseVar>
				<ResponseVar name="opaque">
					<ResponseCatcher catchGroupIndex="2">
						<Regex><![CDATA[(opaque=")(.*?)(")]]></Regex>
					</ResponseCatcher>
				</ResponseVar>
			</ResponseVariables>
		</Response>
		<Response category="okay" followingRequestID="22" waitingTimeInMilliseconds="500">
			<!-- Proxy Authentication Required -->
			<Regex><![CDATA[(SIP/2.0 401)((.*)(\r\n))+(Call-ID: /'call_ID_REGISTER'/@/'targetIP'/)]]></Regex>
			<ResponseVariables>
				<ResponseVar name="nonceRegister">
					<ResponseCatcher catchGroupIndex="2">
						<Regex><![CDATA[(nonce=")(.*?)(")]]></Regex>
					</ResponseCatcher>
				</ResponseVar>
				<ResponseVar name="realmRegister">
					<ResponseCatcher catchGroupIndex="2">
						<Regex><![CDATA[(realm=")(.*?)(")]]></Regex>
					</ResponseCatcher>
				</ResponseVar>
			</ResponseVariables>
		</Response>

	</Request>
	
	<Request requestID="21">
		<Variables>
			<Var name="digestRegister">
				<Digest realm="/'realmRegister'/" uri="sip:/'attackerIP'/" username="/'attackerNr'/" secret="/'secret'/" nonce="/'nonceRegister'/" method="REGISTER"/>
			</Var>
		</Variables>
		<Timeout timeInMilliseconds="2000" message="no answer"/>
		<Content><![CDATA[REGISTER sip:/'targetIP'/ SIP/2.0
Via: SIP/2.0/UDP /'attackerIP'/:/'attackerPort'/
Max-Forwards: 20
To: <sip:/'attackerNr'/@/'targetIP'/>
From: <sip:/'attackerNr'/@/'attackerIP'/>;tag=RegisterAndInviteAttempt
Call-ID: /'call_ID_REGISTER'/@/'targetIP'/
CSeq: 2 REGISTER
Contact: <sip:/'attackerNr'/@/'attackerIP'/:/'attackerPort'/>
Proxy-Authorization: Digest username="/'attackerNr'/",realm="/'realmRegister'/",nonce="/'nonceRegister'/",uri="sip:/'attackerIP'/",response="/'digestRegister'/",opaque="/'opaque'/"
Content-Length: 0

]]></Content>
		<Response category="warning">
			<!-- REGISTER Authentication was not accepted -->
			<Regex><![CDATA[(SIP/2.0 4)((.*)(\r\n))+(Call-ID: /'call_ID_REGISTER'/@/'targetIP'/)]]></Regex>
		</Response>
		<Response category="okay" followingRequestID="3" waitingTimeInMilliseconds="500">
			<!-- REGISTER was accepted by the Proxy -->
			<Regex><![CDATA[(SIP/2.0 200)((.*)(\r\n))+(Call-ID: /'call_ID_REGISTER'/@/'targetIP'/)]]></Regex>
		</Response>
	</Request>

	<Request requestID="22">
		<Variables>
			<Var name="digestRegister">
				<Digest realm="/'realmRegister'/" uri="sip:/'attackerIP'/" username="/'attackerNr'/" secret="/'secret'/" nonce="/'nonceRegister'/" method="REGISTER"/>
			</Var>
		</Variables>
		<Timeout timeInMilliseconds="2000" message="no answer"/>
		<Content><![CDATA[REGISTER sip:/'targetIP'/ SIP/2.0
Via: SIP/2.0/UDP /'attackerIP'/:/'attackerPort'/
Max-Forwards: 20
To: <sip:/'attackerNr'/@/'targetIP'/>
From: <sip:/'attackerNr'/@/'attackerIP'/>;tag=RegisterAndInviteAttempt
Call-ID: /'call_ID_REGISTER'/@/'targetIP'/
CSeq: 2 REGISTER
Contact: <sip:/'attackerNr'/@/'attackerIP'/:/'attackerPort'/>
Authorization: Digest username="/'attackerNr'/",realm="/'realmRegister'/",nonce="/'nonceRegister'/",uri="sip:/'attackerIP'/",response="/'digestRegister'/"
Content-Length: 0

]]></Content>
		<Response category="warning">
			<!-- REGISTER Authentication was not accepted -->
			<Regex><![CDATA[(SIP/2.0 4)((.*)(\r\n))+(Call-ID: /'call_ID_REGISTER'/@/'targetIP'/)]]></Regex>
		</Response>
		<Response category="okay" followingRequestID="3" waitingTimeInMilliseconds="500">
			<!-- REGISTER was accepted by the Proxy -->
			<Regex><![CDATA[(SIP/2.0 200)((.*)(\r\n))+(Call-ID: /'call_ID_REGISTER'/@/'targetIP'/)]]></Regex>
		</Response>
	</Request>
	
	<Request requestID="3">
		<MessageModifier>
			<ContentLength/>
		</MessageModifier>
		<Timeout timeInMilliseconds="2000" message="no answer"/>
		<Content><![CDATA[INVITE sip:/'targetNr'/@/'targetIP'/ SIP/2.0
Via: SIP/2.0/UDP /'attackerIP'/:/'attackerPort'/
To: <sip:/'targetNr'/@/'targetIP'/>
From: "attacker" <sip:/'attackerNr'/@/'targetIP'/>;tag=RegisterAndInviteAttempt
Call-ID: /'call_ID_INVITE'/@/'targetIP'/
CSeq: 3 INVITE
Max-Forwards: 20
Contact: <sip:/'attackerNr'/@/'attackerIP'/:/'attackerPort'/>
Allow: INVITE, ACK, CANCEL, OPTIONS, BYE, INFO, REFER, NOTIFY
Supported: replaces
Content-Type: application/sdp
Content-Length: ?

v=0
o=- /'sdp_ID'/ /'sdp_ID'/ IN IP4 /'attackerIP'/
s=Attacker
c=IN IP4 /'attackerIP'/
t=0 0
m=audio 8000 RTP/AVP 0 8 96 3 13 101
a=rtpmap:0 PCMU/8000
a=rtpmap:8 PCMA/8000
a=rtpmap:96 G726-32/8000
a=rtpmap:3 GSM/8000
a=rtpmap:13 CN/8000
a=rtpmap:101 telephone-event/8000
a=fmtp:101 0-16
a=sendrecv
a=direction:active
]]></Content>
		<Response category="okay" followingRequestID="4" waitingTimeInMilliseconds="500">
			<!-- Proxy Authentication Required -->
			<Regex><![CDATA[(SIP/2.0 407)((.*)(\r\n))+(Call-ID: /'call_ID_INVITE'/@/'targetIP'/)]]></Regex>
			<ResponseVariables>
				<ResponseVar name="nonceInvite">
					<ResponseCatcher catchGroupIndex="2">
						<Regex><![CDATA[(nonce=")(.*?)(")]]></Regex>
					</ResponseCatcher>
				</ResponseVar>
				<ResponseVar name="realmInvite">
					<ResponseCatcher catchGroupIndex="2">
						<Regex><![CDATA[(realm=")(.*?)(")]]></Regex>
					</ResponseCatcher>
				</ResponseVar>
			</ResponseVariables>
		</Response>
	</Request>	
	
	<Request requestID="4">
		<MessageModifier>
			<ContentLength/>
		</MessageModifier>
		<Variables>
			<Var name="digestInvite">
				<Digest realm="/'realmInvite'/" uri="sip:/'targetNr'/@/'attackerIP'/" username="/'attackerNr'/" secret="/'secret'/" nonce="/'nonceInvite'/" method="INVITE"/>
			</Var>
		</Variables>	
		<Timeout timeInMilliseconds="2000" message="no answer"/>
		<Content><![CDATA[INVITE sip:/'targetNr'/@/'targetIP'/ SIP/2.0
Via: SIP/2.0/UDP /'attackerIP'/:/'attackerPort'/
To: <sip:/'targetNr'/@/'targetIP'/>
From: "attacker" <sip:/'attackerNr'/@/'targetIP'/>;tag=RegisterAndInviteAttempt
Call-ID: /'call_ID_INVITE'/@/'targetIP'/
CSeq: 4 INVITE
Max-Forwards: 20
Contact: <sip:/'attackerNr'/@/'attackerIP'/:/'attackerPort'/>
Proxy-Authorization: Digest username="/'attackerNr'/",realm="/'realmInvite'/",nonce="/'nonceInvite'/",uri="sip:/'targetNr'/@/'attackerIP'/",response="/'digestInvite'/"
Allow: INVITE, ACK, CANCEL, OPTIONS, BYE, INFO, REFER, NOTIFY
Supported: replaces
Content-Type: application/sdp
Content-Length: ?

v=0
o=- /'sdp_ID'/ /'sdp_ID'/ IN IP4 192.168.0.19
s=Attacker
c=IN IP4 192.168.0.3
t=0 0
m=audio 8000 RTP/AVP 0 8 96 3 13 101
a=rtpmap:0 PCMU/8000
a=rtpmap:8 PCMA/8000
a=rtpmap:96 G726-32/8000
a=rtpmap:3 GSM/8000
a=rtpmap:13 CN/8000
a=rtpmap:101 telephone-event/8000
a=fmtp:101 0-16
a=sendrecv
a=direction:active
]]></Content>
		<Response category="warning">
			<!-- INVITE Authentication was not accepted -->
			<Regex><![CDATA[(SIP/2.0 4)((.*)(\r\n))+(Call-ID: /'call_ID_INVITE'/@/'targetIP'/)]]></Regex>
		</Response>
		<Response category="okay">
			<!-- INVITE was accepted by the Proxy -->
			<Regex><![CDATA[(SIP/2.0 100)((.*)(\r\n))+(Call-ID: /'call_ID_INVITE'/@/'targetIP'/)]]></Regex>
		</Response>
	</Request>
	
</TestCase>
