<TestCase cycles="10" initialRequestMessageID="1" name="TestCase Example 1" xmlns:xsi="http://www.w3.org/2001/XMLSchema-instance" xsi:noNamespaceSchemaLocation="src\persistence\TestCaseSchema.xsd">
	<Variables>
		<Var name="targetNr">
			<ClearText><![CDATA[1111]]></ClearText>
		</Var>
		<Var name="pbxIP">
			<ConfigValue paramName="PbxIP"/>
		</Var>
		<Var name="proxyIP">
			<ConfigValue paramName="ProxyIP"/>
		</Var>
		<Var name="proxyPort">
			<ConfigValue paramName="ProxyPort"/>
		</Var>
		<Var name="fStringExp">
			<StringExpansionFuzzer increment="1"/>
		</Var>
		<Var name="hexValue">
			<HexValueListFuzzer filePath="hexValues.dat"/>
		</Var>
	</Variables>
	<Request id="1">
		<Content><![CDATA[INVITE sip:*98@/'pbxIP'/ SIP/2.0
Via: SIP/2.0/UDP /'proxyIP'/:/'proxyPort'/;rport
From: "tester" <sip:/'targetNr'/@/'pbxIP'/>;tag=474754342
To: "*98"<sip:*98@/'pbxIP'/>
Contact: <sip:/'targetNr'/@/'proxyIP'/:/'proxyPort'/>
Call-ID: A-FF54-4108-959C-42/'fStringExp'/@/'proxyIP'//'hexValue'/
CSeq: 14959 INVITE
Max-Forwards: 70
Content-Type: application/sdp
User-Agent: X-Lite release 1105x
Content-Length: 309

v=0
o=121212 265542245 265542271 IN IP4 192.168.0.20
s=X-Lite
c=IN IP4 192.168.0.20
t=0 0
m=audio 8000 RTP/AVP 0 8 3 98 97 101
a=rtpmap:0 pcmu/8000
a=rtpmap:8 pcma/8000
a=rtpmap:3 gsm/8000
a=rtpmap:98 iLBC/8000
a=rtpmap:97 speex/8000
a=rtpmap:101 telephone-event/8000
a=fmtp:101 0-15
a=sendrecv

]]></Content>
		<Response category="okay" followingRequestID="2" waitingTimeInMilliseconds="10000">
			<Regex><![CDATA[SIP/2.0 (401|407)(.)*]]></Regex>
		</Response>
		<Response category="warning">
			<Regex><![CDATA[SIP/2.0 200 Ok]]></Regex>
		</Response>
	</Request>
	<Request id="2">
		<Timeout timeInMilliseconds="2000" message="dont know"/>
		<Content><![CDATA[REGISTER sip:*98@/'pbxIP'/ SIP/2.0
Via: SIP/2.0/UDP /'proxyIP'/:/'proxyPort'/;rport;branch=z9hG4bK34CB63B2EA8F4726BCEB993CDA5EB4D3
From: "tester" <sip:/'targetNr'/@/'pbxIP'/>;tag=474754342
To: "tester" <sip:/'targetNr'/@'pbxIP'/>
Contact: <sip:/'targetNr'/@/'proxyIP'/:/'proxyPort'/>
Call-ID: A-FF54-4108-959C-42/'fStringExp'/@/'proxyIP'//'hexValue'/
CSeq: 14960 REGISTER
Max-Forwards: 70
Content-Type: application/sdp
User-Agent: SIP Proxy
Content-Length: 0
]]></Content>
		<Response category="okay">
			<Regex><![CDATA[SIP/2.0 (x401|x407)(.)*]]></Regex>
		</Response>
		<Response category="warning">
			<Regex><![CDATA[SIP/2.0 200 Ok]]></Regex>
		</Response>
	</Request>
</TestCase>
